{
  "kind": "orpad.nodePackRegistry",
  "schemaVersion": "1.0",
  "registryId": "orpad.community",
  "name": "OrPAD Community Packages",
  "governance": {
    "registryTrust": "official",
    "reviewModel": "orpad-pr-reviewed",
    "submissions": {
      "type": "pull-request",
      "url": "https://github.com/orpad/registry/pulls"
    },
    "reviewPolicyUrl": "https://orpad.dev/docs/package-registry-review",
    "maintainer": "OrPAD maintainers",
    "notes": "Official community registry entries are admitted through maintainer-reviewed registry pull requests."
  },
  "generatedAt": "2026-05-25T00:00:00.000Z",
  "entries": [
    {
      "id": "community.electron-maintenance",
      "name": "Electron Maintenance Pack",
      "description": "Reusable Electron maintenance orchestration assets.",
      "latestVersion": "0.1.0",
      "versions": [
        {
          "version": "0.1.0",
          "manifestUrl": "https://raw.githubusercontent.com/example/orpad-electron-maintenance-pack/v0.1.0/orpad.node-pack.json",
          "sourceRepository": "https://github.com/example/orpad-electron-maintenance-pack",
          "sourceRef": "v0.1.0",
          "sourceRoot": "",
          "manifestPath": "orpad.node-pack.json",
          "checksums": {
            "manifestSha256": "5b0bcac2d7db822dc30d5d1a2c54b4c7fe4978f269c0f197af8c5aebcfdf4a33"
          },
          "signature": {
            "scheme": "ed25519",
            "value": "fixture-signature"
          },
          "review": {
            "status": "approved",
            "reviewedAt": "2026-05-25T00:00:00.000Z",
            "reviewId": "orpad-registry-pr-42",
            "reviewedBy": "orpad-maintainers",
            "approvedCapabilities": ["read.workspace"]
          }
        }
      ],
      "author": {
        "name": "Example Author",
        "repository": "https://github.com/example/orpad-electron-maintenance-pack"
      },
      "license": "MIT",
      "trustLevel": "community",
      "capabilities": ["read.workspace"],
      "nodeTypes": ["community.electronMaintenance.review"],
      "keywords": ["electron", "maintenance"],
      "categories": ["Maintenance"],
      "links": {
        "docs": "https://github.com/example/orpad-electron-maintenance-pack#readme",
        "issues": "https://github.com/example/orpad-electron-maintenance-pack/issues",
        "changelog": "https://github.com/example/orpad-electron-maintenance-pack/releases"
      }
    },
    {
      "id": "community.content-review",
      "name": "Content Review Pack",
      "description": "Reusable content review orchestration assets.",
      "latestVersion": "0.2.0",
      "versions": [
        {
          "version": "0.1.0",
          "manifestUrl": "https://raw.githubusercontent.com/example/orpad-content-review-pack/v0.1.0/orpad.node-pack.json",
          "sourceRepository": "https://github.com/example/orpad-content-review-pack",
          "sourceRef": "v0.1.0",
          "sourceRoot": "",
          "manifestPath": "orpad.node-pack.json",
          "checksums": {
            "manifestSha256": "b8880bf36e7a7e80e3052b98476fa1c073a7273b515f5fa68b8b81d30f72b344"
          }
        },
        {
          "version": "0.2.0",
          "manifestUrl": "https://raw.githubusercontent.com/example/orpad-content-review-pack/v0.2.0/orpad.node-pack.json",
          "sourceRepository": "https://github.com/example/orpad-content-review-pack",
          "sourceRef": "v0.2.0",
          "sourceRoot": "",
          "manifestPath": "orpad.node-pack.json",
          "checksums": {
            "manifestSha256": "6a08a4f4d5e601bc3c08239df9ac2f9a3a52d0f2790d733fc1b86404f115b71f"
          }
        }
      ],
      "author": {
        "name": "Example Author",
        "repository": "https://github.com/example/orpad-content-review-pack"
      },
      "license": "MIT",
      "trustLevel": "community",
      "capabilities": ["read.workspace"],
      "nodeTypes": ["community.contentReview.note"],
      "keywords": ["content", "review", "documentation"],
      "categories": ["Content"],
      "links": {
        "docs": "https://github.com/example/orpad-content-review-pack#readme"
      }
    }
  ],
  "signature": {
    "scheme": "ed25519",
    "keyId": "orpad-registry-fixture",
    "value": "fixture-registry-signature"
  }
}
